{
  "schemaVersion": 1,
  "generatedAt": "2026-08-29T12:00:00Z",
  "lastFullReconciliationAt": "2026-08-29T12:00:00Z",
  "status": "synthetic",
  "synthetic": true,
  "source": {
    "name": "UK Parliament Bills API",
    "baseUrl": "https://bills-api.parliament.uk/api/v1",
    "sessionId": 40,
    "sessionLabel": "2026-27",
    "attribution": "Contains Parliamentary information licensed under the Open Parliament Licence v3.0.",
    "licenceUrl": "https://www.parliament.uk/site-information/copyright-parliament/open-parliament-licence/"
  },
  "counts": {
    "total": 24,
    "active": 20,
    "enacted": 2,
    "withdrawn": 1,
    "failed": 1,
    "unknown": 0,
    "specialOrUnclassified": 3
  },
  "warnings": [
    {
      "code": "synthetic_example_data",
      "message": "This is example data generated for local development. It does not describe any real Bill before the UK Parliament.",
      "severity": "info"
    },
    {
      "code": "unknown_stage_id",
      "message": "Some Bills are at a stage this build does not recognise and are shown as unclassified rather than being placed by guesswork.",
      "severity": "info",
      "billIds": [
        9019
      ]
    }
  ],
  "dataHash": "sha256:3ff1926409b876eecd0d7d23b8658870b8f4ccbf76c267ad290a421d6f93e37f",
  "bills": [
    {
      "id": 9012,
      "title": "Arbitration Bill",
      "formerTitle": null,
      "summary": "A Bill to consolidate the law relating to arbitration.",
      "parliamentUrl": "https://bills.parliament.uk/bills/9012",
      "billType": {
        "id": 2,
        "name": "Private Members' Bill (Starting in the House of Lords)",
        "category": "Public"
      },
      "originatingHouse": "lords",
      "currentHouse": "lords",
      "introducedSessionId": 40,
      "includedSessionIds": [
        40
      ],
      "carriedOver": false,
      "sourceLastUpdate": "2026-08-19T17:00:00.0000000",
      "withdrawnSourceDate": null,
      "status": "active",
      "pipelineNode": "lords_first_reading",
      "lastKnownPipelineNode": "lords_first_reading",
      "mappingMode": "direct",
      "nonStandardRoute": false,
      "stage": {
        "billStageId": 9012000,
        "stageId": 1,
        "sessionId": 40,
        "label": "1st reading",
        "abbreviation": "1R",
        "house": "lords",
        "sortOrder": 1,
        "sittings": [
          {
            "id": 901201,
            "date": "2026-08-19",
            "sourceDateTime": "2026-08-19T00:00:00"
          }
        ],
        "nextSittingDate": null,
        "detail": null
      },
      "sponsors": [
        {
          "memberId": 1013,
          "name": "Lord Example of Westhaven",
          "house": "lords",
          "party": "Crossbench",
          "organisation": null
        }
      ],
      "history": [
        {
          "billStageId": 9012000,
          "stageId": 1,
          "sessionId": 40,
          "label": "1st reading",
          "abbreviation": "1R",
          "house": "lords",
          "sortOrder": 1,
          "sittings": [
            {
              "id": 901201,
              "date": "2026-08-19",
              "sourceDateTime": "2026-08-19T00:00:00"
            }
          ],
          "mappedNode": "lords_first_reading",
          "mappingMode": "direct"
        }
      ],
      "pingPongExchangeNumber": null,
      "detailsComplete": true,
      "historyComplete": true,
      "warnings": []
    },
    {
      "id": 9010,
      "title": "Border Security Bill",
      "formerTitle": null,
      "summary": "A Bill to make provision about border security.",
      "parliamentUrl": "https://bills.parliament.uk/bills/9010",
      "billType": {
        "id": 1,
        "name": "Government Bill",
        "category": "Public"
      },
      "originatingHouse": "commons",
      "currentHouse": "lords",
      "introducedSessionId": 40,
      "includedSessionIds": [
        40
      ],
      "carriedOver": false,
      "sourceLastUpdate": "2026-08-23T12:00:00.0000000",
      "withdrawnSourceDate": null,
      "status": "active",
      "pipelineNode": "lords_third_reading",
      "lastKnownPipelineNode": "lords_third_reading",
      "mappingMode": "direct",
      "nonStandardRoute": false,
      "stage": {
        "billStageId": 9010009,
        "stageId": 5,
        "sessionId": 40,
        "label": "3rd reading",
        "abbreviation": "3R",
        "house": "lords",
        "sortOrder": 10,
        "sittings": [
          {
            "id": 901001,
            "date": "2026-09-18",
            "sourceDateTime": "2026-09-18T00:00:00"
          }
        ],
        "nextSittingDate": "2026-09-18",
        "detail": null
      },
      "sponsors": [
        {
          "memberId": 1011,
          "name": "Yvette Hallam",
          "house": "commons",
          "party": "Example Party A",
          "organisation": "Example Department"
        }
      ],
      "history": [
        {
          "billStageId": 9010000,
          "stageId": 6,
          "sessionId": 40,
          "label": "1st reading",
          "abbreviation": "1R",
          "house": "commons",
          "sortOrder": 1,
          "sittings": [],
          "mappedNode": "commons_first_reading",
          "mappingMode": "direct"
        },
        {
          "billStageId": 9010001,
          "stageId": 7,
          "sessionId": 40,
          "label": "2nd reading",
          "abbreviation": "2R",
          "house": "commons",
          "sortOrder": 2,
          "sittings": [],
          "mappedNode": "commons_second_reading",
          "mappingMode": "direct"
        },
        {
          "billStageId": 9010002,
          "stageId": 8,
          "sessionId": 40,
          "label": "Committee stage",
          "abbreviation": "CS",
          "house": "commons",
          "sortOrder": 3,
          "sittings": [],
          "mappedNode": "commons_committee",
          "mappingMode": "direct"
        },
        {
          "billStageId": 9010003,
          "stageId": 9,
          "sessionId": 40,
          "label": "Report stage",
          "abbreviation": "RS",
          "house": "commons",
          "sortOrder": 4,
          "sittings": [],
          "mappedNode": "commons_report",
          "mappingMode": "direct"
        },
        {
          "billStageId": 9010004,
          "stageId": 10,
          "sessionId": 40,
          "label": "3rd reading",
          "abbreviation": "3R",
          "house": "commons",
          "sortOrder": 5,
          "sittings": [],
          "mappedNode": "commons_third_reading",
          "mappingMode": "direct"
        },
        {
          "billStageId": 9010005,
          "stageId": 1,
          "sessionId": 40,
          "label": "1st reading",
          "abbreviation": "1R",
          "house": "lords",
          "sortOrder": 6,
          "sittings": [],
          "mappedNode": "lords_first_reading",
          "mappingMode": "direct"
        },
        {
          "billStageId": 9010006,
          "stageId": 2,
          "sessionId": 40,
          "label": "2nd reading",
          "abbreviation": "2R",
          "house": "lords",
          "sortOrder": 7,
          "sittings": [],
          "mappedNode": "lords_second_reading",
          "mappingMode": "direct"
        },
        {
          "billStageId": 9010007,
          "stageId": 3,
          "sessionId": 40,
          "label": "Committee stage",
          "abbreviation": "CS",
          "house": "lords",
          "sortOrder": 8,
          "sittings": [],
          "mappedNode": "lords_committee",
          "mappingMode": "direct"
        },
        {
          "billStageId": 9010008,
          "stageId": 4,
          "sessionId": 40,
          "label": "Report stage",
          "abbreviation": "RS",
          "house": "lords",
          "sortOrder": 9,
          "sittings": [],
          "mappedNode": "lords_report",
          "mappingMode": "direct"
        },
        {
          "billStageId": 9010009,
          "stageId": 5,
          "sessionId": 40,
          "label": "3rd reading",
          "abbreviation": "3R",
          "house": "lords",
          "sortOrder": 10,
          "sittings": [
            {
              "id": 901001,
              "date": "2026-09-18",
              "sourceDateTime": "2026-09-18T00:00:00"
            }
          ],
          "mappedNode": "lords_third_reading",
          "mappingMode": "direct"
        }
      ],
      "pingPongExchangeNumber": null,
      "detailsComplete": true,
      "historyComplete": true,
      "warnings": []
    },
    {
      "id": 9016,
      "title": "Charities Regulation Bill",
      "formerTitle": null,
      "summary": "A Bill to make provision about the regulation of charities.",
      "parliamentUrl": "https://bills.parliament.uk/bills/9016",
      "billType": {
        "id": 2,
        "name": "Private Members' Bill (Starting in the House of Lords)",
        "category": "Public"
      },
      "originatingHouse": "lords",
      "currentHouse": "commons",
      "introducedSessionId": 40,
      "includedSessionIds": [
        40
      ],
      "carriedOver": false,
      "sourceLastUpdate": "2026-08-21T16:00:00.0000000",
      "withdrawnSourceDate": null,
      "status": "active",
      "pipelineNode": "commons_second_reading",
      "lastKnownPipelineNode": "commons_second_reading",
      "mappingMode": "direct",
      "nonStandardRoute": false,
      "stage": {
        "billStageId": 9016006,
        "stageId": 7,
        "sessionId": 40,
        "label": "2nd reading",
        "abbreviation": "2R",
        "house": "commons",
        "sortOrder": 7,
        "sittings": [
          {
            "id": 901601,
            "date": "2026-09-19",
            "sourceDateTime": "2026-09-19T00:00:00"
          }
        ],
        "nextSittingDate": "2026-09-19",
        "detail": null
      },
      "sponsors": [
        {
          "memberId": 1017,
          "name": "Baroness Example of Thurloe",